{
  "runId": "poseidon-pilot-2026-05-17-001",
  "runConfigRef": "https://stac.marine.copernicus.eu/collections/poseidon-config-north-gotland/items/run-001-config",
  "stacCollection": "https://stac.marine.copernicus.eu/collections/poseidon-output-north-gotland",
  "runMetadata": {
    "startedAt": "2026-05-17T08:14:00Z",
    "finishedAt": "2026-05-17T09:47:12Z",
    "simulatedFromYear": 2010,
    "simulatedToYear": 2025,
    "timeStepUnit": "day",
    "seed": 42,
    "modelVersion": "POSEIDON 2.3.1",
    "hostEnvironment": "edito-modellab-jh"
  },
  "timeSeries": [
    {
      "name": "Species 0 Biomass",
      "asset": "s3://edito-pilot/north-gotland/output/run-001/biomass.parquet",
      "mediaType": "application/vnd.apache.parquet",
      "cadence": "yearly",
      "unit": "kg",
      "dimension": "per-species",
      "stacItem": "https://stac.marine.copernicus.eu/collections/poseidon-output-north-gotland/items/run-001-biomass"
    },
    {
      "name": "Species 0 Landings",
      "asset": "s3://edito-pilot/north-gotland/output/run-001/landings.parquet",
      "mediaType": "application/vnd.apache.parquet",
      "cadence": "yearly",
      "unit": "kg",
      "dimension": "per-species"
    },
    {
      "name": "Average Cash-Flow",
      "asset": "s3://edito-pilot/north-gotland/output/run-001/cashflow.parquet",
      "mediaType": "application/vnd.apache.parquet",
      "cadence": "yearly",
      "unit": "EUR",
      "dimension": "per-segment"
    }
  ],
  "agentLogs": [
    {
      "name": "Fisher Trips",
      "asset": "s3://edito-pilot/north-gotland/output/run-001/trips.parquet",
      "mediaType": "application/vnd.apache.parquet",
      "agentType": "fisher",
      "spatialGeometry": "linestring"
    }
  ],
  "gridded": [
    {
      "name": "Fishing Effort Heatmap",
      "asset": "s3://edito-pilot/north-gotland/output/run-001/effort.zarr",
      "mediaType": "application/vnd.zarr",
      "variable": "fishing_hours",
      "unit": "h/km2/year",
      "gridRef": "https://stac.marine.copernicus.eu/collections/poseidon-map-north-gotland/items/grid-1nm",
      "cadence": "yearly"
    }
  ],
  "events": [
    {
      "name": "Closure Invocations",
      "asset": "s3://edito-pilot/north-gotland/output/run-001/closures.parquet"
    }
  ],
  "validationLinks": [
    {
      "modelProductRef": "Species 0 Biomass",
      "empiricalRef": "https://stac.marine.copernicus.eu/collections/poseidon-bio-north-gotland/items/sag-her-27-2532-ssb",
      "metric": "Pearson_r",
      "value": 0.86
    }
  ]
}
